{
  "schema_version": "m2.v1",
  "paper_id": "paper-legacy-metadata",
  "title": "Legacy metadata paper",
  "authors": ["Family, Given", "Literal contributor"],
  "year": 2022,
  "publication_venue": "Local Journal",
  "doi": "https://doi.org/10.1234/LEGACY",
  "pdf_access_status": "unavailable",
  "assigned_project_ids": ["project-legacy"],
  "created_at": "2026-07-19T12:00:00Z",
  "updated_at": "2026-07-19T12:00:00Z"
}
